{
  "id": "doc-research-khurusamphan-association-0001",
  "th": {
    "title": "สมาคมคุรุสัมพันธ์อิสลามแห่งประเทศไทยในพระบรมราชูปถัมภ์: ประวัติ, ระบบหน่วยสอบฟัรฎูอัยน์, และปัญหาการบริหารวิชาการ",
    "title_alt": [],
    "category": "research",
    "issuing_body": "รวบรวมจากหน้าประวัติสมาคมคุรุสัมพันธ์ฯ (ไม่ทราบเว็บไซต์ต้นทางแน่ชัด) และบทที่ 1 วิทยานิพนธ์/สารนิพนธ์ (ผู้ให้สัมภาษณ์: มนูญ โต๊ะอาจ, ผู้ช่วยศาสตราจารย์ คณะศิลปศาสตร์ มหาวิทยาลัยชินวัตร)",
    "document_no": null,
    "enacted_date_be": null,
    "effective_date": null,
    "status": "in_force",
    "summary": "**ยืนยันการมีอยู่จริงของ 'สมาคมคุรุสัมพันธ์อิสลามแห่งประเทศไทยในพระบรมราชูปถัมภ์' ที่เคยติดป้าย ⏳ ยังไม่ยืนยันไว้ใน docs/RELATED_ORGANIZATIONS.md** จาก 2 แหล่งอิสระ: **(1) ประวัติหน่วยสอบที่ 1** — สมาคมก่อกำเนิดจากการรวมตัวของศิษย์อาจารย์**ต่วน สุวรรณศาสน์** (ผู้ซึ่งภายหลังดำรงตำแหน่ง**จุฬาราชมนตรี**) เริ่มสอนวิชาศาสนาภาคฟัรฎูอีนตั้งแต่ พ.ศ. 2497 หลักสูตร 4 ปี ควบคู่ภาคสามัญ จดทะเบียนสมาคมเมื่อ พ.ศ. 2499 เปิดสนามสอบวัดผล+มอบประกาศนียบัตรตั้งแต่ พ.ศ. 2500 มี 10 หน่วยสอบ หน่วยสอบที่ 1 (โรงเรียนอันยุมันอิสลาม → ย้ายมาโรงเรียนศาสนศึกษาบางอุทิศ พ.ศ. 2523 หลังโรงเรียนเดิมเลิกกิจการ) มีรายชื่อหัวหน้าหน่วยสอบต่อเนื่องตั้งแต่ท่านผู้หญิงสมร ภูมิณรงค์ จนถึงอาจารย์อามีน (มานพ) ศรีสวาท (จบจากอียิปต์) พิธีเปิดที่ทำการถาวรหน่วยสอบที่ 1 (25 ต.ค. 2551) ได้รับเกียรติจาก**นายอรุณ บุญชม** (ขณะนั้นดำรงตำแหน่งประธานกรรมการอิสลามประจำกรุงเทพมหานคร — บุคคลเดียวกับที่ต่อมาได้รับเลือกเป็น**จุฬาราชมนตรีคนที่ 19**ตามที่ยืนยันไว้แล้วใน doc-other-cicot-board-org-chart-0001) ปัจจุบันหน่วยสอบที่ 1 มีโรงเรียนในสังกัด 7 แห่ง **(2) บทที่ 1 วิทยานิพนธ์/สารนิพนธ์เรื่อง 'ปัญหาและแนวทางพัฒนาการบริหารงานวิชาการของสถาบันสอนศาสนาอิสลามภาคฟัรฎูอัยน์ในหน่วยสอบที่ 5 สังกัดสมาคมคุรุสัมพันธ์ฯ'** — อธิบายว่าฟัรฎูอัยน์เป็นการศึกษาศาสนาภาคบังคับทางศาสนา (ไม่มีผลบังคับตามกฎหมายไทย) ที่สถาบันสอนศาสนาอิสลามส่วนใหญ่ในไทยส่วนใหญ่ (แต่ไม่ทั้งหมด) สังกัดสมาคมคุรุสัมพันธ์ฯ เพราะมีหลักสูตร+การวัดผลชัดเจน สถิติ 2561-2563 ของหน่วยสอบที่ 5 แสดงจำนวนผู้เรียน/ผู้สำเร็จการศึกษาลดลงต่อเนื่อง อ้างงานวิจัยของนูรุดดีน สารีมิง (2549) สรุปปัญหาตาดีกาทั่วไป: ขาดสื่อ/อุปกรณ์การสอน ค่าตอบแทนครูต่ำ ขาดอาคารสถานที่/บุคลากร/งบประมาณ เวลาเรียนน้อย การเทียบโอนเข้าโรงเรียนเอกชนสอนศาสนาอิสลามไม่ราบรื่น ขาดการดูแลจากผู้นำศาสนา/ผู้ทรงคุณวุฒิ ขาดการสนับสนุนจากหน่วยงานรัฐ **สรุปภาพระบบการศึกษาศาสนาอิสลามไทยตอนนี้มี 3 รางขนาน**: (ก) ตาดีกา — ศูนย์ประจำมัสยิด ระดับปฐมวัย (ดู doc-guideline-krabi-mosque-admin-manual-0001, doc-research-mosque-admin-songkhla-2561-0001); (ข) โรงเรียนเอกชนสอนศาสนาอิสลาม มาตรา 15(1)(2) — กำกับ/อุดหนุนโดยกระทรวงศึกษาธิการ/สช. (ดู doc-regulation-islamic-teacher-subsidy-moe-2550-0001); (ค) **สมาคมคุรุสัมพันธ์อิสลามฯ** — ระบบหลักสูตร+สอบวัดผลฟัรฎูอัยน์คู่ขนาน ไม่ใช่หน่วยงานรัฐ ไม่ใช่ CICOT แต่มีจุฬาราชมนตรีบางท่าน (ต่วน สุวรรณศาสน์, อรุณ บุญชม) เกี่ยวข้องในประวัติศาสตร์การก่อตั้ง/พิธีการ",
    "scope_provinces": ["กรุงเทพมหานคร"],
    "keywords": ["สมาคมคุรุสัมพันธ์อิสลาม", "ฟัรฎูอัยน์", "หน่วยสอบ", "ต่วน สุวรรณศาสน์", "ตาดีกา"],
    "related_document_ids": [
      "doc-other-cicot-board-org-chart-0001",
      "doc-regulation-islamic-teacher-subsidy-moe-2550-0001",
      "doc-research-mosque-admin-songkhla-2561-0001",
      "doc-guideline-krabi-mosque-admin-manual-0001"
    ]
  },
  "en": {
    "title": "Islamic Teachers Relations Association of Thailand, Under Royal Patronage: History, the Fardhu 'Ain Exam-Unit System, and Academic Administration Problems",
    "title_alt": [],
    "issuing_body": "Compiled from the Association's own history page (source website not clearly identified) and Chapter 1 of a thesis (interviewee: Manoon Toh-ard, Assistant Professor, Faculty of Liberal Arts, Shinawatra University)",
    "summary": "**Confirms the real existence of the 'Islamic Teachers Relations Association of Thailand, Under Royal Patronage', previously flagged unverified (⏳) in docs/RELATED_ORGANIZATIONS.md**, from 2 independent sources: **(1) History of Exam Unit No.1** - the association arose from students of Ustaz **Tuan Suwannasart** (who later became **Chularajmontri**), who began teaching the fardhu 'ain religious curriculum in 1954 (a 4-year curriculum alongside general schooling), registered as an association in 1956, and opened examination/certification centers from 1957 with 10 exam units. Exam Unit 1 (originally at Anyuman Islam School, moved to Bang Uthit Religious School in 1980 after the original school closed) has a documented succession of unit heads from Lady Samorn Phumnarong through to Ajarn Ameen (Manop) Srisawat (Egypt-educated). The permanent office opening ceremony for Exam Unit 1 (25 Oct 2008) was honored by **Mr. Arun Bunchom** (then Chairman of the Bangkok Islamic Committee - the same person later elected as the **19th Chularajmontri**, per doc-other-cicot-board-org-chart-0001). Exam Unit 1 currently has 7 affiliated schools. **(2) Chapter 1 of a thesis on 'Problems and Development Guidelines for Academic Administration of Islamic Institutes Teaching Fardhu 'Ain under Exam Unit 5 of the Association'** - explains fardhu 'ain as religiously (not legally) compulsory basic religious education, which most (not all) Islamic teaching institutes in Thailand affiliate with the Association for due to its standardized curriculum/assessment. FY2018-2020 statistics for Exam Unit 5 show continuously declining enrollment/graduation, citing Nuruddin Sareemeng's 2006 research on general Tadika problems: lack of teaching materials, low teacher pay, inadequate facilities/staff/budget, limited class time, poor articulation into private Islamic schools, lack of religious-leader oversight, and lack of state support. **This confirms Thailand's Islamic religious education system runs on 3 parallel tracks**: (a) Tadika - mosque-based, early-childhood level (see doc-guideline-krabi-mosque-admin-manual-0001, doc-research-mosque-admin-songkhla-2561-0001); (b) private Islamic schools under Sections 15(1)/(2) - regulated/subsidized by the Ministry of Education/OPEC (see doc-regulation-islamic-teacher-subsidy-moe-2550-0001); (c) **the Islamic Teachers Relations Association** - a parallel fardhu 'ain curriculum and examination system, neither a state agency nor CICOT, but historically linked to CICOT leadership through founding figures who later became Chularajmontri (Tuan Suwannasart, Arun Bunchom).",
    "keywords": ["Islamic Teachers Relations Association", "fardhu 'ain", "examination unit", "Tuan Suwannasart", "tadika"],
    "translation_status": "machine",
    "translated_at": "2026-08-22T05:00:00+07:00",
    "translated_by": "claude_code"
  },
  "source": {
    "document_pdf": null,
    "document_url": null,
    "publisher": null,
    "published_date": null,
    "retrieved_date": "2026-08-21",
    "page_ref": "ข้อความเต็มที่ผู้ใช้ส่งมาโดยตรง (2 แหล่ง) ไม่มี URL/ชื่อผู้แต่งวิทยานิพนธ์/มหาวิทยาลัยยืนยันครบถ้วน",
    "checksum_sha256": null
  },
  "provenance": {
    "extracted_by": "claude_code",
    "extracted_at": "2026-08-22T05:00:00+07:00",
    "extraction_method": "manual",
    "verified": false,
    "verified_by": null,
    "verified_at": null
  }
}
