{
  "id": "doc-research-kfc-halal-provincial-institute-link-0001",
  "th": {
    "title": "กรณีศึกษา KFC และการรับรองฮาลาล: ความสัมพันธ์ระหว่าง กอจ., สถาบันวิทยาศาสตร์ฮาลาล, และ CICOT",
    "title_alt": [],
    "category": "research",
    "issuing_body": "รวบรวมจาก MGR Online (ศูนย์ข่าวภูเก็ต), เฟซบุ๊กส่วนตัว รศ.ดร.วินัย ดะห์ลัน, และบทความ ARAYA NIKAH",
    "document_no": null,
    "enacted_date_be": null,
    "effective_date": null,
    "status": "in_force",
    "summary": "รวบรวมจาก 3 แหล่งต่างเวลากันเพื่อสืบความสัมพันธ์เชิงสถาบันระหว่าง กอจ. (คณะกรรมการอิสลามประจำจังหวัด), สถาบันวิทยาศาสตร์ฮาลาลระดับมหาวิทยาลัย, และ CICOT ผ่านกรณีศึกษาการรับรองฮาลาล KFC ในไทย: **(1) ข่าว MGR Online 14 มิ.ย. 2557** — กอจ.ภูเก็ต (ประธาน ด.ต.โกมล ดุมลักษณ์ ซึ่งดำรงตำแหน่งรองเลขาธิการ CICOT ด้วย — ตรงกับรายชื่อกรรมการกลางที่ ingest ไว้ก่อนหน้าใน doc-other-cicot-board-org-chart-0001) ชี้แจงการรับรองฮาลาล KFC 11 สาขาในภูเก็ต อาศัยอำนาจ **มาตรา 26(13) พ.ร.บ.2540** + **ข้อ 10 ระเบียบ กอท. ว่าด้วยการดำเนินกิจการฮาลาล พ.ศ. 2552** (ให้ กอจ.รับรองฮาลาลในเขตจังหวัดตนเอง จังหวัดใดไม่มี กอจ. ให้ CICOT รับรองแทน — ยืนยันกลไกเดียวกับที่ระบุใน doc-regulation-cicot-provincial-mosque-committee-operations-2560-0001 หมวด 4) วัตถุดิบส่งตรวจที่**สถาบันฮาลาล มหาวิทยาลัยสงขลานครินทร์ วิทยาเขตหาดใหญ่** (ไม่ใช่จุฬาฯ — แสดงว่ามีสถาบันวิทยาศาสตร์ฮาลาลระดับมหาวิทยาลัยมากกว่าหนึ่งแห่งที่ กอจ.ใช้บริการได้) หมายเหตุ: ระเบียบ พ.ศ.2552 ที่อ้างถึงนี้เป็นฉบับเก่ากว่า doc-regulation-cicot-halal-management-2558-0001 (2558) ที่มีอยู่แล้ว ยืนยันสายวิวัฒนาการ 2552→2558→2568(compilation) ที่ระบุไว้ใน doc-regulation-cicot-halal-compilation-2568-0001 **(2) โพสต์เฟซบุ๊ก รศ.ดร.วินัย ดะห์ลัน 5 ธ.ค. 2558** — ผู้เขียนระบุตนเองเป็น 'กรรมการ' (CICOT) อธิบายว่าเหตุที่ KFC ไทยไม่ได้รับรองฮาลาลทั่วประเทศ เพราะ**เจ้าของกิจการไม่ยื่นขอ/ไม่มีเจตนา (เนียต)** ไม่ใช่เพราะส่วนผสมไม่ฮาลาล อธิบายหลักชะรีอะฮ์ 4 แหล่ง (อัลกุรอาน ซุนนะฮ์ อิจมาอ์ กิยาส) ยกตัวอย่างจริงที่ กอจ.เชียงใหม่ตรวจพบโรงเชือดไก่บริษัทใหญ่มี 2 สายการผลิต (ฮาลาล/ไม่ฮาลาล) ระบุมูลค่าอุตสาหกรรมฮาลาลโลก ~36 ล้านล้านบาท/ปี **ผู้เขียนคือบุคคลเดียวกับ 'รศ.ดร.วินัย ดะห์ลัน' ที่ปรากฏในรายชื่อรองประธาน CICOT (doc-other-cicot-board-org-chart-0001) — ยืนยันว่าหัวหน้าศูนย์วิทยาศาสตร์ฮาลาล จุฬาลงกรณ์มหาวิทยาลัย กับรองประธาน CICOT เป็นบุคคลเดียวกัน — นี่คือจุดเชื่อมโครงสร้างที่เป็นรูปธรรมที่สุดระหว่าง CICOT กับสถาบันวิชาการฮาลาลที่พบในระบบนี้** **(3) บทความ ARAYA NIKAH (แหล่งที่มา/วันที่ไม่ระบุชัดในข้อความที่ได้รับ)** — สรุปประวัติ: KFC เคยรับรองฮาลาลบางสาขา (ภูเก็ต กระบี่) จนกระทั่ง CICOT เปลี่ยนนโยบายบังคับรับรองทั้งระบบแฟรนไชส์ทั่วประเทศ (มติที่ประชุม CICOT ณ โรงแรมเกรซแลนด์ ภูเก็ต 29 พ.ค. 2557) ทำให้ KFC ไม่ต่อสัญญา (ประมาณการค่าใช้จ่ายรับรองทั้งระบบ ~25-47 ล้านบาท/ปี ขึ้นกับปี/จำนวนสาขา) มีการอ้างอิงคำชี้แจงของนายไพศาล พรหมยงค์ (ประธาน กอจ.สมุทรปราการ อดีตประธานฝ่ายกิจการฮาลาล CICOT) ว่า 'ไม่ขอ = บอกไม่ได้ว่าฮาลาลหรือฮารอม' ชี้แจงข่าวลือเท็จเรื่องไขมันหมู (แท้จริงเป็นคดีเครื่องหมายการค้าระหว่างแฟรนไชส์ซีกับสำนักงานใหญ่ในต่างประเทศ ไม่เกี่ยวส่วนผสม) **ข้อจำกัดของแหล่งข้อมูล**: ทั้ง 3 แหล่งเป็นข่าว/บล็อก/โซเชียลมีเดีย ไม่ใช่เอกสารราชการ ตัวเลขค่าธรรมเนียม/จำนวนสาขา/วันที่บางจุดยังไม่ยืนยันไขว้กับเอกสารทางการ ต้องระวังไม่ถือเป็นข้อเท็จจริงสมบูรณ์",
    "scope_provinces": ["ภูเก็ต", "เชียงใหม่", "สมุทรปราการ"],
    "keywords": ["ฮาลาล KFC", "วินัย ดะห์ลัน", "ศูนย์วิทยาศาสตร์ฮาลาล จุฬาฯ", "สถาบันฮาลาล มอ.", "เนียต"],
    "related_document_ids": [
      "doc-law-islamic-org-admin-act-0001",
      "doc-regulation-cicot-halal-management-2558-0001",
      "doc-regulation-cicot-halal-compilation-2568-0001",
      "doc-regulation-cicot-provincial-mosque-committee-operations-2560-0001",
      "doc-other-cicot-board-org-chart-0001"
    ]
  },
  "en": {
    "title": "KFC Halal Case Study: The Link Between Provincial Islamic Committees, University Halal Science Institutes, and CICOT",
    "title_alt": [],
    "issuing_body": "Compiled from MGR Online (Phuket News Center), a personal Facebook post by Assoc. Prof. Winai Dahlan, and an ARAYA NIKAH article",
    "summary": "Compiled from 3 sources across different times to trace the institutional relationship between Provincial Islamic Committees, university-level Halal Science institutes, and CICOT, via the case of KFC's halal certification in Thailand: **(1) MGR Online, 14 June 2014** - the Phuket Provincial Islamic Committee (chaired by Pol.Sr.Sgt.Maj. Komol Dumlak, who also holds the CICOT Deputy Secretary-General role - matching the central committee roster already ingested in doc-other-cicot-board-org-chart-0001) explained its certification of 11 Phuket KFC branches, citing **Section 26(13) of the 1997 Act** plus **Article 10 of the 2009 CICOT Halal Operations Regulation** (provincial committees certify within their own province; CICOT certifies where no provincial committee exists - matching the mechanism in doc-regulation-cicot-provincial-mosque-committee-operations-2560-0001, Chapter 4). Ingredients were tested at the **Halal Institute, Prince of Songkla University, Hat Yai campus** (not Chulalongkorn - showing more than one university halal-science institute serves provincial committees). Note: the cited 2009 regulation predates doc-regulation-cicot-halal-management-2558-0001 (2015) already in this archive, confirming the 2009->2015->2025(compilation) lineage noted in doc-regulation-cicot-halal-compilation-2568-0001. **(2) Facebook post by Assoc. Prof. Winai Dahlan, 5 December 2015** - the author identifies himself as a CICOT 'committee member', explaining that Thai KFC lacks nationwide halal certification because **the business owner never applied / lacked the intention (niyyah)** to seek it - not because ingredients are non-halal. Explains the 4 sources of Shariah reasoning (Quran, Sunnah, Ijma, Qiyas), cites a real case where Chiang Mai's provincial committee found a major poultry company running both halal and non-halal slaughter lines, and states the global halal industry is worth ~36 trillion baht/year. **The author is the same 'Assoc. Prof. Winai Dahlan' listed as a CICOT Vice-Chairman (doc-other-cicot-board-org-chart-0001) - confirming that the head of Chulalongkorn University's Halal Science Center and a CICOT Vice-Chairman are the same person - the most concrete institutional link found in this archive between CICOT and academic halal-science institutions.** **(3) An ARAYA NIKAH article (source/date not clearly given in the text received)** - summarizes the history: KFC once held halal certification for some branches (Phuket, Krabi) until CICOT changed policy to require nationwide franchise-wide certification (per a CICOT meeting resolution at the Graceland Hotel, Phuket, 29 May 2014), causing KFC to not renew (estimated system-wide certification cost ~25-47 million baht/year depending on year/branch count). Cites a statement from Mr. Paisan Phromyong (Chair, Samut Prakan Provincial Islamic Committee; former Chair, CICOT Halal Affairs Division) that 'no application = cannot say halal or haram'. Debunks a false rumor about pork fat (actually an international trademark dispute between a franchisee and headquarters, unrelated to ingredients). **Source limitation**: all 3 sources are news/blog/social media, not official documents; some fee/branch-count/date figures are not cross-verified against official documents - should not be treated as fully established fact.",
    "keywords": ["KFC halal", "Winai Dahlan", "Chulalongkorn Halal Science Center", "PSU Halal Institute", "niyyah"],
    "translation_status": "machine",
    "translated_at": "2026-08-22T03:00:00+07:00",
    "translated_by": "claude_code"
  },
  "source": {
    "document_pdf": null,
    "document_url": null,
    "publisher": "MGR Online / Facebook / ARAYA NIKAH",
    "published_date": "2014-06-14",
    "retrieved_date": "2026-08-21",
    "page_ref": "ข้อความเต็มที่ผู้ใช้ส่งมาโดยตรง ไม่มี URL ยืนยันครบทุกแหล่ง",
    "checksum_sha256": null
  },
  "provenance": {
    "extracted_by": "claude_code",
    "extracted_at": "2026-08-22T03:00:00+07:00",
    "extraction_method": "manual",
    "verified": false,
    "verified_by": null,
    "verified_at": null
  }
}
