{
  "id": "doc-research-mosque-admin-songkhla-2561-0001",
  "th": {
    "title": "มัสยิดในชุมชนทุ่งตำเสากับการบริหารตามหลักอิสลาม",
    "title_alt": ["Mosques in Thung Tam Sao and Islamic Administration"],
    "category": "research",
    "issuing_body": "ณัฎฐา ประดิษฐ์, กิตติธัช ชูช่วย, อุทัย ปริญญาสุทธินันท์ (คณะศิลปศาสตร์ มหาวิทยาลัยสงขลานครินทร์)",
    "document_no": "วารสารมนุษยศาสตร์และสังคมศาสตร์ มหาวิทยาลัยมหาสารคาม ปีที่ 37 ฉบับที่ 1 (มกราคม-กุมภาพันธ์ 2561)",
    "enacted_date_be": null,
    "effective_date": null,
    "status": "in_force",
    "summary": "งานวิจัยเชิงคุณภาพ ศึกษาการบริหารองค์กรตามหลักอิสลามของมัสยิดในชุมชนทุ่งตำเสา ตำบลทุ่งตำเสา อำเภอหาดใหญ่ จังหวัดสงขลา (**พื้นที่นอกเขต 4 จังหวัดชายแดนภาคใต้ที่มี พ.ร.บ.พิเศษ** — กรณีศึกษาที่แสดงการบริหารมัสยิดปกติทั่วประเทศภายใต้ พ.ร.บ.การบริหารองค์กรศาสนาอิสลาม พ.ศ. 2540 เพียงฉบับเดียว) สัมภาษณ์เชิงลึก+สนทนากลุ่ม+สังเกตแบบมีส่วนร่วม ผู้ให้ข้อมูล 50 คน (กรรมการอิสลามประจำมัสยิด 9 คน, สัปบุรุษ 30 คน, เจ้าหน้าที่ อปท. 5 คน, นักวิชาการ 6 คน) ประวัติมัสยิด: สร้างจากเงินบริจาคร่วมกับองค์กรการกุศลอิสลามนานาชาติฐานคูเวต โครงสร้างหกเหลี่ยม+ต่อเติมสี่เหลี่ยม มีคณะกรรมการอิสลามประจำมัสยิด 13 คน (นายเหม บิน... เป็นประธาน — ชื่อเต็มถูกตัดในการสกัดข้อความ) ผลการศึกษาแบ่งบทบาทอิหม่าม 4 ด้าน: **(1) ด้านศาสนา** — นำละหมาด 5 เวลา/คุตบะห์วันศุกร์ (คอเต็บ/บิหลั่นทำแทนได้), จัดอบรมก่อนแต่งงาน (นิกะห์) ที่สำนักงานคณะกรรมการอิสลามประจำจังหวัด ก่อนทำพิธี — ถ้าไม่ผ่านอบรมปรับ 1,000-2,000 บาท/คน, จัดการศพให้เสร็จภายใน 24 ชั่วโมง, แบ่งมรดกตามพินัยกรรมอิสลาม (หรือแบ่งเองถ้าไม่มีพินัยกรรม โดยมีคอเต็บ+บิหลั่นเป็นพยาน), ดูแลการเก็บ-จ่ายซะกาต; **(2) ด้านการศึกษา** — ดูแลศูนย์อบรมศาสนาอิสลามและจริยธรรมประจำมัสยิด (ตาดีกา, เด็กอายุ 5-12 ปี, ฟัรดูอีน), ห้องสมุด, ลานกีฬา, อบรมมุอัลลัฟ(มุสลิมใหม่)/มุสลิมะฮ์แม่บ้าน/วิชาชีพ; **(3) ด้านการปกครอง** — ไกล่เกลี่ยข้อพิพาทระหว่างมุสลิม (เชิญผู้ใหญ่บ้านร่วมถ้าจำเป็น), ส่งต่อผู้มีอำนาจถ้าเกินความสามารถ; **(4) ด้านการบริหาร** — แผนผังองค์กร: อิหม่าม(ประธาน)→คอเต็บ(รองประธาน1)+บิหลั่น(รองประธาน2)→เลขานุการ→กรรมการฝ่ายการศึกษา/ฝ่ายกิจการฮาลาล/ฝ่ายวิชาการ/ฝ่ายสังคมสงเคราะห์ (แผนผังจริงจากมัสยิดหนึ่งแห่ง เทียบเคียงได้กับโครงสร้างในคู่มือกระบี่ doc-guideline-krabi-mosque-admin-manual-0001) สรุป: บทบาททั้ง 4 ด้าน+พ.ร.บ.2540 ทำให้มัสยิดพัฒนาต่อเนื่อง เป็นสถาบันสำคัญต่อจิตวิญญาณมุสลิมในชุมชน",
    "scope_provinces": ["สงขลา"],
    "keywords": ["อิหม่าม", "บทบาทอิหม่าม", "ทุ่งตำเสา", "นิกะห์", "ตาดีกา", "โครงสร้างมัสยิด"],
    "related_document_ids": ["doc-law-islamic-org-admin-act-0001", "doc-guideline-krabi-mosque-admin-manual-0001"]
  },
  "en": {
    "title": "Mosques in Thung Tam Sao and Islamic Administration",
    "title_alt": [],
    "issuing_body": "Nattha Pradit, Kittitat Chuchuay, Utai Parinyasutinun (Faculty of Liberal Arts, Prince of Songkla University)",
    "summary": "A qualitative study of Islamic-principle organizational administration at a mosque in Thung Tam Sao, Hat Yai district, Songkhla (**outside the 4 southern provinces covered by the special 1946 Act** - a case study of ordinary mosque administration nationwide under only the 1997 Islamic Organization Administration Act). In-depth interviews, focus groups, and participant observation with 50 informants (9 mosque Islamic committee members, 30 congregants, 5 local government officers, 6 academics). Mosque history: built with donations plus an international Islamic charity based in Kuwait; hexagonal structure with a later square extension; a 13-member mosque Islamic committee. Findings break the imam's role into 4 dimensions: **(1) Religious** - leading 5 daily prayers/Friday khutbah (Khatib/Bilal can substitute), pre-marriage (nikah) training at the provincial Islamic committee office before the ceremony - a 1,000-2,000 baht fine per person for skipping it, funeral management within 24 hours, inheritance distribution per Islamic will (or personally if no will, with Khatib+Bilal as witnesses), overseeing zakat collection/distribution; **(2) Educational** - overseeing the mosque's Islamic education and ethics center (Tadika, ages 5-12, fardhu ain), library, sports field, training for muallaf (new Muslims)/women's groups/vocational skills; **(3) Governance** - mediating disputes between Muslims (involving the village headman if needed), escalating to authorities beyond the imam's capacity; **(4) Administrative** - an organizational chart: Imam (chair) -> Khatib (1st vice-chair) + Bilal (2nd vice-chair) -> Secretary -> committee members for Education/Halal Affairs/Academic/Social Welfare (a real single-mosque org chart, comparable to the Krabi manual's structure, doc-guideline-krabi-mosque-admin-manual-0001). Conclusion: these 4 role dimensions plus the 1997 Act enable continuous mosque development and uphold the mosque as a spiritually important institution for the local Muslim community.",
    "keywords": ["imam", "imam's roles", "Thung Tam Sao", "nikah", "tadika", "mosque organizational structure"],
    "translation_status": "machine",
    "translated_at": "2026-08-22T02:00:00+07:00",
    "translated_by": "claude_code"
  },
  "source": {
    "document_pdf": "sources/originals/2561-research-mosque-admin-songkhla.pdf",
    "document_url": null,
    "publisher": "วารสารมนุษยศาสตร์และสังคมศาสตร์ มหาวิทยาลัยมหาสารคาม",
    "published_date": null,
    "retrieved_date": "2026-08-21",
    "page_ref": "ทั้งฉบับ (11 หน้า)",
    "checksum_sha256": "d0e1b8da9d93c347ed2d4959352aec8f89156789719794c19c03233d20d627c9"
  },
  "provenance": {
    "extracted_by": "claude_code",
    "extracted_at": "2026-08-22T02:00:00+07:00",
    "extraction_method": "pdf-text",
    "verified": false,
    "verified_by": null,
    "verified_at": null
  }
}
