{
  "id": "doc-research-islamic-law-4-provinces-thesis-1986-0001",
  "th": {
    "title": "การใช้กฎหมายอิสลามในเขตจังหวัดปัตตานี นราธิวาส ยะลา และสตูล (วิทยานิพนธ์)",
    "title_alt": ["Application of Muslim Law in Pattani, Narathiwat, Yala and Satun"],
    "category": "research",
    "issuing_body": "จุฬาลงกรณ์มหาวิทยาลัย (ภาควิชานิติศาสตร์ บัณฑิตวิทยาลัย)",
    "document_no": "ISBN 974-566-669-6",
    "enacted_date_be": null,
    "effective_date": null,
    "status": "in_force",
    "summary": "วิทยานิพนธ์ปริญญานิติศาสตรมหาบัณฑิต โดยนายสมบูรณ์ พุทธจักร (Somboon Puttajuk) จุฬาลงกรณ์มหาวิทยาลัย พ.ศ. 2529 (1986) แบ่ง 6 บท: บทที่ 1 บทนำ; บทที่ 2 เหตุผลทางการปกครองและสังคมวิทยาศาสนาในการใช้กฎหมายอิสลาม (เพื่อเอกภาพของสังคม, เพื่อบูรณาการ, เพื่อแก้ปัญหาการเมือง/การปกครอง); บทที่ 3 สถานภาพเปรียบเทียบของกฎหมายอิสลามในหลายประเทศ (การร่างประมวลกฎหมายอิสลามของตุรกีและอียิปต์, สถานภาพในศรีลังกา/ซีลอน อินเดีย มาเลเซีย สิงคโปร์ อินโดนีเซีย ฟิลิปปินส์ ทั้งช่วงก่อน/ระหว่าง/หลังอาณานิคม); บทที่ 4 ลักษณะการใช้กฎหมายอิสลาม (แนวคิด Muslim Personal Law, การประมวลกฎหมายอิสลามเป็นระบบ); บทที่ 5 การพิจารณาคดี การระงับข้อพิพาท และที่ปรึกษากฎหมาย (3 สถาบัน: ศาลศาสนา/Shariah court, คณะกรรมการอิสลาม/คณะกรรมการไกล่เกลี่ยข้อพิพาทและที่ปรึกษากฎหมายอิสลาม, สำนักงานทะเบียนสมรส-หย่า); บทที่ 6 บทสรุปและข้อเสนอแนะ. บทสรุปวิพากษ์ว่า พ.ร.บ. พ.ศ.2489 (doc-law-islamic-law-4-provinces-2489-0001) ขาดรายละเอียดเทียบกับระบบของฟิลิปปินส์/ศรีลังกา/สิงคโปร์ และเสนอ 4 ข้อ: (1) จำกัดขอบเขตการใช้เฉพาะคู่สมรสที่แต่งงานตามหลักอิสลามใน 4 จังหวัด; (2) จดทะเบียนสมรส/หย่าของมุสลิมโดยให้เจ้าหน้าที่ศาสนาทำหน้าที่นายทะเบียนในฐานะเจ้าพนักงาน และตั้งคณะกรรมการพิจารณามรดกที่มีผลผูกพันคู่กรณีที่ยอมรับ; (3) เปิดช่องให้อุทธรณ์คำวินิจฉัยดะโต๊ะยุติธรรมได้ (ต่างจากที่ พ.ร.บ.2489 กำหนดให้เด็ดขาด); (4) ปรับปรุงคุณสมบัติ วิธีคัดเลือก และการแต่งตั้งดะโต๊ะยุติธรรมให้เหมาะสมยิ่งขึ้น — ข้อ (3) และ (4) นี้ชี้ตรงไปยังช่องว่างที่ พ.ร.บ.2489 ไม่ได้ระบุไว้เอง เป็นแหล่งอ้างอิงเชิงวิชาการสำคัญสำหรับ docs/JUSTICE_SYSTEM_DAG.md ในระบบนี้ — ยังไม่ได้อ่านเนื้อหาเต็มทุกบท (อ่านบทคัดย่อ+โครงหน้าสารบัญ+หน้าแรกแต่ละบทเท่านั้น จาก ~229 หน้ารวม)",
    "scope_provinces": ["ปัตตานี", "นราธิวาส", "ยะลา", "สตูล"],
    "keywords": ["ดะโต๊ะยุติธรรม", "Muslim Personal Law", "กฎหมายเปรียบเทียบ", "วิทยานิพนธ์"],
    "related_document_ids": ["doc-law-islamic-law-4-provinces-2489-0001", "doc-guideline-islamic-law-family-inheritance-judiciary-2554-0001"]
  },
  "en": {
    "title": "Application of Muslim Law in Pattani, Narathiwat, Yala and Satun (Thesis)",
    "title_alt": [],
    "issuing_body": "Chulalongkorn University (Department of Law, Graduate School)",
    "summary": "A Master of Laws thesis by Mr. Somboon Puttajuk, Chulalongkorn University, 1986, in 6 chapters: Ch.1 Introduction; Ch.2 Administrative and religious-sociological rationale for applying Islamic law (social unity, integration, addressing political/administrative problems); Ch.3 Comparative status of Islamic law across countries (Ottoman/Egyptian codification, Ceylon, India, Malaysia, Singapore, Indonesia, the Philippines, across pre-colonial/colonial/post-independence periods); Ch.4 Characteristics of Islamic law application (the Muslim Personal Law concept, systematic codification); Ch.5 Adjudication, dispute resolution, and legal counsel (three institutions: the Shariah court, the Islamic committee/mediation-and-counsel committee, and the marriage/divorce registry office); Ch.6 Conclusion and recommendations. The conclusion critiques the 1946 Act (doc-law-islamic-law-4-provinces-2489-0001) as under-detailed compared to the Philippine/Sri Lankan/Singaporean systems, proposing: (1) limit application to spouses married under Islamic law within the 4 provinces; (2) register Muslim marriages/divorces via religious officials acting as government registrars, and establish a family-succession committee whose accepted decisions carry evidentiary weight; (3) allow appeal of Dato Yuttitham rulings (currently final under the 1946 Act); (4) reform the qualification, selection, and appointment criteria for Dato Yuttitham. Points (3) and (4) directly target gaps the 1946 Act leaves unaddressed - a key academic source for docs/JUSTICE_SYSTEM_DAG.md in this archive. Not yet read in full (abstract, table of contents, and each chapter's first page only, out of ~229 total pages).",
    "keywords": ["Dato Yuttitham", "Muslim Personal Law", "comparative law", "thesis"],
    "translation_status": "machine",
    "translated_at": "2026-08-21T22:20:00+07:00",
    "translated_by": "claude_code"
  },
  "source": {
    "document_pdf": "sources/originals/somboon-thesis-1986/Somboon_Pu_front.pdf",
    "document_url": null,
    "publisher": "จุฬาลงกรณ์มหาวิทยาลัย",
    "published_date": "1986-01-01",
    "retrieved_date": "2026-08-21",
    "page_ref": "front matter (19 หน้า) อ่านครบ; ch1-ch6+back (210 หน้า) อ่านเฉพาะหน้าแรกของแต่ละบทเท่านั้น — ไฟล์แยก 8 ไฟล์ใน sources/originals/somboon-thesis-1986/",
    "checksum_sha256": "5d46613e628a47d297c168484c804161a54d0887deb8a8244831c4e9500170ca"
  },
  "provenance": {
    "extracted_by": "claude_code",
    "extracted_at": "2026-08-21T22:20:00+07:00",
    "extraction_method": "manual",
    "verified": false,
    "verified_by": null,
    "verified_at": null
  }
}
