{
  "id": "doc-research-islamic-law-recommendations-prachatai-2552-0001",
  "th": {
    "title": "ข้อเสนอแนะการใช้กฎหมายอิสลามของชาวมุสลิม (ชื่อเดิม: ข้อเสนอแนะสำหรับประเทศไทยกรณีการใช้กฎหมายอิสลามของชาวมุสลิม)",
    "title_alt": [],
    "category": "research",
    "issuing_body": "อุสตาซอับดุชชะกูรฺ บิน ชาฟิอีย์ (อับดุลสุโก ดินอะ) อาจารย์พิเศษมหาวิทยาลัยทักษิณ",
    "document_no": null,
    "enacted_date_be": null,
    "effective_date": null,
    "status": "in_force",
    "summary": "บทความเผยแพร่ทางประชาไท 21 ธันวาคม 2552 ชี้ประเด็นสำคัญที่ยังไม่มีในระบบนี้มาก่อน: **ขอบเขตของ พ.ร.บ.2489 จำกัดเฉพาะ 4 จังหวัด (ปัตตานี นราธิวาส ยะลา สตูล) ทำให้มุสลิมนอกเขตนี้ (เช่น กรุงเทพฯ สงขลา) ไม่ได้รับสิทธิ์ทางกฎหมายเดียวกัน** ต้องพึ่งอนุญาโตตุลาการ (แต่งตั้งจากคณะกรรมการอิสลามประจำจังหวัดหรือผู้รู้ศาสนา เป็นลายลักษณ์อักษร) แทน ผู้เขียนเรียกภาวะนี้ว่า 'วัฒนธรรมชายขอบซ้อนชายขอบ' (Marginalization ซ้อนกัน) และ 'การเลือกปฏิบัติ' ระหว่างมุสลิมด้วยกันเอง — ตั้งแต่หลักฐานแรก พ.ศ.2444 ('กฎข้อบังคับสำหรับปกครองบริเวณ 7 หัวเมือง') ไม่เคยขยายขอบเขตเลยกว่า 100 ปี **ข้อมูลประวัติศาสตร์ใหม่**: มุสลิมในปัตตานี/นราธิวาส/ยะลา/สตูล เคยถูก**ยกเลิก**การใช้กฎหมายอิสลามลักษณะครอบครัว/มรดกโดยรัฐบาลจอมพล ป. พิบูลสงคราม ระหว่าง พ.ศ. 2486-2488 (ช่วงนโยบายรัฐนิยม) ก่อนจะได้รับการฟื้นฟูกลับมาด้วย พ.ร.บ.2489 (doc-law-islamic-law-4-provinces-2489-0001) — ข้อมูลนี้เติมเต็มช่วงว่างในเส้นเวลาที่ docs/JUSTICE_SYSTEM_DAG.md เคยมีระหว่าง 2484 (คู่มือ ยธ.) กับ 2489 (พ.ร.บ.). **ข้อมูลเปรียบเทียบต่างประเทศละเอียด** (อ้างจากวิทยานิพนธ์สมบูรณ์ พุทธจักร 2529 + หนังสือ 'ศาลศาสนา (Shariah Court)' โดยเด่น โต๊ะมีนา ซึ่งรวบรวมจากการประชุม 1st ASEAN Shariah Administrator Conference Workshop มะนิลา 7-11 ส.ค.2526): ศรีลังกามีศาลชะรีอะฮ์ 52 ศาล (ตั้ง ค.ศ.1983), ฟิลิปปินส์มีศาลชะรีอะฮ์ประจำท้องถิ่น+ประจำภาครวม 51 ศาลใน 5 ภาค, สิงคโปร์มีคณะกรรมการอุทธรณ์ (Appeal Board) ที่คำวินิจฉัยเป็นที่สุด, ฟิลิปปินส์อุทธรณ์ได้ถึงศาลฎีกา, ศรีลังกายกเลิกการใช้บรรทัดฐานกฎหมายทั่วไปสำหรับมุสลิมโดยเฉพาะ **5 ข้อเสนอแนะ**: (1) แก้ไข พ.ร.บ.2489 และหลักกฎหมายอิสลามที่ใช้มาตั้งแต่ 2489; (2) จัดทำประมวลวิธีพิจารณาความและกฎหมายลักษณะพยานเฉพาะ — ตรงกับข้อเสนอของ**คณะกรรมการอิสระเพื่อความสมานฉันท์แห่งชาติ (กอส.) 2549** (องค์กรใหม่ที่ยังไม่เคยปรากฏในระบบนี้); (3) ขยายกฎหมายทั่วประเทศโดยให้ดะโต๊ะยุติธรรมประจำอยู่ระดับภาค (ไม่ต้องทุกจังหวัด) แบบเดียวกับศาลแรงงาน/ศาลล้มละลาย/ศาลทรัพย์สินทางปัญญากลาง (ตามข้อเสนอของประคอง เตกฉัตร อดีตผู้พิพากษาหัวหน้าศาลจังหวัดยะลา); (4) ตรา 'พระราชบัญญัติการบริหารกฎหมายอิสลาม' ฉบับใหม่แทน พ.ร.บ.2540; (5) ตั้งสำนักงานทะเบียนอิสลามสำหรับสมรส/หย่า/เปลี่ยนศาสนา — ทั้ง 5 ข้อยังไม่พบหลักฐานว่าถูกนำไปปฏิบัติจริงในเอกสารอื่นของระบบนี้ (ณ 2567 บทความของสุรเดช บินรามัน ยังระบุปัญหาเดิมซ้ำ)",
    "scope_provinces": [],
    "keywords": ["ขอบเขตทางภูมิศาสตร์", "อนุญาโตตุลาการ", "คณะกรรมการอิสระเพื่อความสมานฉันท์แห่งชาติ", "กฎหมายเปรียบเทียบ", "การเลือกปฏิบัติ"],
    "related_document_ids": ["doc-law-islamic-law-4-provinces-2489-0001", "doc-research-islamic-law-4-provinces-thesis-1986-0001", "doc-guideline-islamic-procedural-law-article-suradet-0001", "doc-research-islamic-law-history-isranews-2567-0001"]
  },
  "en": {
    "title": "Recommendations on Muslims' Use of Islamic Law (originally: Recommendations for Thailand on Muslims' Use of Islamic Law)",
    "title_alt": [],
    "issuing_body": "Ustaz Abdulshukur bin Shafi'i (Abdulsuko Dina), Special Lecturer at Thaksin University",
    "summary": "An article published via Prachatai on 21 December 2009, raising a point not previously in this archive: **the 1946 Act's scope is limited to just 4 provinces (Pattani, Narathiwat, Yala, Satun), leaving Muslims elsewhere (e.g., Bangkok, Songkhla) without the same legal recognition** - they must instead rely on arbitration (appointed in writing via the provincial Islamic committee or religious scholars). The author calls this a 'doubly marginalized culture' and 'discrimination' between Muslims themselves - the scope has never been expanded since the first evidence in 1901 ('Regulation for Governing the Seven Towns Area'), over 100 years. **New historical detail**: Muslims in Pattani/Narathiwat/Yala/Satun had their use of Islamic family/inheritance law **abolished** by the Phibulsongkram government from 1943-1945 (during the Ratthaniyom/Thai-nationalism policy period), before it was restored via the 1946 Act (doc-law-islamic-law-4-provinces-2489-0001) - this fills a gap in docs/JUSTICE_SYSTEM_DAG.md's timeline between 1941 (MOJ handbook) and 1946 (the Act). **Detailed comparative data** (citing Somboon Puttajuk's 1986 thesis plus Den Tomeena's book 'Shariah Court', compiled from the 1st ASEAN Shariah Administrator Conference Workshop, Manila, 7-11 Aug 1983): Sri Lanka has 52 Shariah courts (established 1983), the Philippines has Shariah Circuit and District Courts totaling 51 courts across 5 regions, Singapore's Appeal Board decisions are final, the Philippines allows appeal up to the Supreme Court, and Sri Lanka abolished general-law precedent specifically for Muslims. **5 recommendations**: (1) amend the 1946 Act and the Islamic law principles used since 1946; (2) create a dedicated procedural and evidence code - matching a recommendation from the **National Reconciliation Commission (2006)** (a body not previously appearing in this archive); (3) expand nationally with regional (not per-province) Dato Yuttitham, similar to the Central Labour Court/Bankruptcy Court/IP & International Trade Court model (per Prakong Tekchat, former Chief Judge of Yala Provincial Court); (4) enact a new 'Islamic Law Administration Act' to replace the 2540 Act; (5) establish an Islamic Registry Office for marriage/divorce/conversion. None of these 5 recommendations appear to have been implemented per other documents in this archive (as of 2024, Suradet Binraman's article still cites the same unresolved problems).",
    "keywords": ["geographic scope", "arbitration", "National Reconciliation Commission", "comparative law", "discrimination"],
    "translation_status": "machine",
    "translated_at": "2026-08-22T00:00:00+07:00",
    "translated_by": "claude_code"
  },
  "source": {
    "document_pdf": null,
    "document_url": null,
    "publisher": "ประชาไท (prachatai.com)",
    "published_date": "2009-12-21",
    "retrieved_date": "2026-08-21",
    "page_ref": "บทความเต็ม (ผู้ใช้ส่งข้อความมาโดยตรง ไม่มี URL ยืนยัน)",
    "checksum_sha256": null
  },
  "provenance": {
    "extracted_by": "claude_code",
    "extracted_at": "2026-08-22T00:00:00+07:00",
    "extraction_method": "manual",
    "verified": false,
    "verified_by": null,
    "verified_at": null
  }
}
