{
  "id": "doc-law-islamic-org-admin-act-0001",
  "th": {
    "title": "พระราชบัญญัติการบริหารองค์กรศาสนาอิสลาม พ.ศ. 2540",
    "title_alt": [
      "พ.ร.บ.การบริหารองค์กรศาสนาอิสลาม พ.ศ. 2540",
      "พ.ร.บ.อิสลาม 2540"
    ],
    "category": "law",
    "issuing_body": "รัฐสภาไทย (ตราขึ้นในรัชกาลที่ 9); เผยแพร่ไฟล์โดยสำนักจุฬาราชมนตรี",
    "document_no": null,
    "enacted_date_be": "17 ตุลาคม 2540",
    "effective_date": null,
    "status": "in_force",
    "summary": "พ.ร.บ. ฉบับนี้ตราขึ้นเพื่อยกเลิกและปรับปรุงกฎหมายเดิม 3 ฉบับที่ล้าสมัย ได้แก่ พ.ร.บ.มัสยิดอิสลาม พ.ศ. 2490, พระราชกฤษฎีกาว่าด้วยการศาสนูปถัมภ์ฝ่ายอิสลาม พุทธศักราช 2488 และฉบับที่ 2 พ.ศ. 2491 (มาตรา 3) มีทั้งหมด 46 มาตรา แบ่งเป็น 5 หมวดและบทเฉพาะกาล ได้แก่: หมวด 1 บททั่วไป (มาตรา 1-11) — การแต่งตั้ง คุณสมบัติ อำนาจหน้าที่ และการพ้นจากตำแหน่งของจุฬาราชมนตรี ผู้นำกิจการศาสนาอิสลามในประเทศไทยที่พระมหากษัตริย์ทรงแต่งตั้ง; หมวด 2 การจัดตั้งและการเลิกมัสยิด (มาตรา 12-15) — มัสยิดที่จดทะเบียนแล้วมีฐานะเป็นนิติบุคคล โดยคณะกรรมการอิสลามประจำมัสยิดเป็นผู้แทน; หมวด 3 คณะกรรมการกลางอิสลามแห่งประเทศไทย (มาตรา 16-22) — องค์ประกอบ คุณสมบัติ อำนาจหน้าที่ (เช่น ออกระเบียบ ให้คำปรึกษาส่วนราชการ วินิจฉัยคำร้องคัดค้าน) และวาระ 6 ปี; หมวด 4 คณะกรรมการอิสลามประจำจังหวัด (มาตรา 23-29) — จัดตั้งได้เมื่อจังหวัดมีมัสยิดไม่น้อยกว่า 3 แห่ง มีอำนาจกำกับดูแลมัสยิดในจังหวัด ออกหนังสือรับรองสมรส/หย่าตามบัญญัติศาสนาอิสลาม และประนีประนอมข้อพิพาทครอบครัว/มรดก; หมวด 5 คณะกรรมการอิสลามประจำมัสยิด (มาตรา 30-42) — องค์ประกอบ (อิหม่าม คอเต็บ บิหลั่น และกรรมการอื่น 6-12 คน) คุณสมบัติ วิธีคัดเลือก อำนาจหน้าที่ในการดูแลมัสยิด ทะเบียนสัปปุรุษ และทรัพย์สิน; บทเฉพาะกาล (มาตรา 43-46) — ให้ผู้ดำรงตำแหน่งเดิมและมัสยิดที่จดทะเบียนไว้แล้วตามกฎหมายเก่ามีผลต่อเนื่องภายใต้กฎหมายใหม่",
    "scope_provinces": [],
    "keywords": [
      "จุฬาราชมนตรี",
      "คณะกรรมการกลางอิสลามแห่งประเทศไทย",
      "คณะกรรมการอิสลามประจำจังหวัด",
      "คณะกรรมการอิสลามประจำมัสยิด",
      "มัสยิด",
      "สัปปุรุษ",
      "อิหม่าม",
      "คอเต็บ",
      "บิหลั่น"
    ],
    "related_document_ids": []
  },
  "en": {
    "title": "Islamic Organization Administration Act, B.E. 2540 (1997)",
    "title_alt": [
      "Act on the Administration of Islamic Organizations B.E. 2540 (1997)"
    ],
    "issuing_body": "Parliament of Thailand; PDF published by the Office of the Chularajmontri",
    "summary": "This Act repeals and modernizes three outdated laws — the Islamic Mosque Act B.E. 2490 (1947), and the Royal Decrees on Islamic Religious Endowment B.E. 2488 (1945) and its 2nd amendment B.E. 2491 (1948) (Section 3). It has 46 sections across 5 chapters plus transitional provisions: Chapter 1, General Provisions (Sections 1-11) — appointment, qualifications, powers, and removal of the Chularajmontri, the royally-appointed leader of Islamic affairs in Thailand; Chapter 2, Establishment and Dissolution of Mosques (Sections 12-15) — a registered mosque becomes a juristic person represented by its mosque Islamic committee; Chapter 3, Central Islamic Committee of Thailand (Sections 16-22) — composition, qualifications, powers (issuing regulations, advising government ministries, ruling on appeals), 6-year terms; Chapter 4, Provincial Islamic Committees (Sections 23-29) — established where a province has at least 3 registered mosques; oversees mosques in the province, issues Islamic marriage/divorce certificates, mediates family/inheritance disputes; Chapter 5, Mosque Islamic Committees (Sections 30-42) — composition (Imam, Khatib, Bilal, plus 6-12 other members), qualifications, selection process, powers over mosque affairs, the congregant registry, and mosque property; Transitional Provisions (Sections 43-46) — incumbents and mosques already registered under the old law continue under the new Act.",
    "keywords": [
      "Chularajmontri",
      "Central Islamic Committee of Thailand",
      "Provincial Islamic Committee",
      "Mosque Islamic Committee",
      "mosque",
      "congregant",
      "Imam",
      "Khatib",
      "Bilal"
    ],
    "translation_status": "machine",
    "translated_at": "2026-08-21T14:20:00+07:00",
    "translated_by": "claude_code"
  },
  "source": {
    "document_pdf": "sources/originals/2540-phra-ratchabanyat-islamic-org-admin.pdf",
    "document_url": "https://www.skthai.org/th/pages/24358",
    "publisher": "สำนักจุฬาราชมนตรี (Office of the Chularajmontri)",
    "published_date": null,
    "retrieved_date": "2026-08-21",
    "page_ref": "ทั้งฉบับ (มาตรา 1-46 และบทเฉพาะกาล)",
    "checksum_sha256": "d8bc31240d36fc415b6052fdc6bbc265f520512c4dfb0115ac59548e70ad624e"
  },
  "provenance": {
    "extracted_by": "claude_code",
    "extracted_at": "2026-08-21T14:20:00+07:00",
    "extraction_method": "manual",
    "verified": false,
    "verified_by": null,
    "verified_at": null
  }
}
